{
  "version": "1.0",
  "job_id": "example_02_stack",
  "reading_direction": "ltr",
  "page_template": "custom",
  "page_width_px": 1080,
  "page_height_px": 1920,
  "bleed_px": 20,
  "gutter_px": 20,
  "page_background": "#FFFFFF",
  "base_seed": 2,
  "style_prompt":     { "positive": "manga style, clean linework", "negative": "blurry" },
  "character_prompt": { "positive": "young man, short hair, casual clothes", "negative": "" },
  "default_sampler":  { "sampler_name": "euler", "scheduler": "normal", "steps": 25, "cfg": 7.0, "denoise": 1.0 },
  "default_border":   { "width_px": 2, "color": "#000000", "style": "solid" },
  "pages": [
    {
      "page_index": 1,
      "page_prompt": { "positive": "morning street, soft light", "negative": "" },
      "layout_mode": "vertical_stack",
      "panels": [
        {
          "panel_index": 1,
          "scene_prompt": { "positive": "establishing shot of a quiet morning street, soft sunlight", "negative": "" },
          "width_px": 1040, "height_px": 800,
          "align": "center", "shape": { "type": "rect" }
        },
        {
          "panel_index": 2,
          "scene_prompt": { "positive": "young man stepping out of an apartment door", "negative": "" },
          "width_px": 1000, "height_px": 400,
          "align": "left", "shape": { "type": "rect" }
        },
        {
          "panel_index": 3,
          "scene_prompt": { "positive": "young man turning with surprise as a passerby walks by", "negative": "" },
          "width_px": 1040, "height_px": 620,
          "align": "right", "shape": { "type": "rect" }
        }
      ]
    }
  ]
}
