{
  "version": "1.0",
  "job_id": "example_04_rtl",
  "reading_direction": "rtl",
  "page_template": "custom",
  "page_width_px": 1080,
  "page_height_px": 1920,
  "bleed_px": 20,
  "gutter_px": 20,
  "page_background": "#FFFFFF",
  "base_seed": 4,
  "style_prompt":     { "positive": "japanese manga, ink, screentone", "negative": "color, realistic" },
  "character_prompt": { "positive": "teenage girl, school uniform", "negative": "" },
  "default_sampler":  { "sampler_name": "euler", "scheduler": "normal", "steps": 25, "cfg": 7.0, "denoise": 1.0 },
  "default_border":   { "width_px": 2, "color": "#000000", "style": "solid" },
  "pages": [
    {
      "page_index": 1,
      "page_prompt": { "positive": "shrine, tranquil", "negative": "" },
      "layout_mode": "vertical_stack",
      "panels": [
        {
          "panel_index": 1,
          "scene_prompt": { "positive": "a teenage girl walking into a shrine gate", "negative": "" },
          "width_px": 1040, "height_px": 500,
          "align": "center", "shape": { "type": "rect" }
        },
        {
          "panel_index": 2,
          "scene_prompt": { "positive": "the girl kneeling to draw a fortune strip", "negative": "" },
          "width_px": 1040, "height_px": 400,
          "align": "center", "shape": { "type": "rect" }
        },
        {
          "panel_index": 3,
          "scene_prompt": { "positive": "close-up on fortune paper, kanji clearly visible, dramatic", "negative": "" },
          "width_px": 1040, "height_px": 940,
          "align": "center", "shape": { "type": "rect" }
        }
      ]
    }
  ]
}
